{
  "items": [
    {
      "name": "research-agent-pack",
      "latestVersion": "1.4.0",
      "description": "Research assistant with literature analysis tools",
      "role": "plugin",
      "providers": ["arxiv", "semantic-scholar"],
      "components": [
        { "type": "skill", "name": "summarize-paper" },
        { "type": "tool", "name": "arxiv-search" }
      ]
    }
  ],
  "total": 1,
  "limit": 20,
  "offset": 0
}
